{
  "slug": "frozen-dataclass",
  "title": "Frozen Dataclasses",
  "roadmap": "python-swe",
  "kind": "concept",
  "tier": "tier2",
  "metadata": {
    "difficulty": "easy",
    "estimated_minutes": 20,
    "importance": 7,
    "interview_frequency": "low",
    "prerequisites": [
      "dataclasses"
    ],
    "unlocks": [],
    "project_usage": [
      "Configuration objects",
      "Value objects",
      "Caching/Hashing"
    ]
  },
  "glossary": [
    {
      "term": "immutable",
      "definition": "An object whose state or data cannot be changed or modified after it is created. Example: `frozenset([1, 2])`"
    },
    {
      "term": "hashable",
      "definition": "An object that has a fixed value that never changes during its lifetime, allowing it to be used as a dictionary key or set item. Example: `hash('text')`"
    }
  ],
  "overview": {
    "what": "A frozen dataclass is a dataclass where instances cannot be modified after initialization. It uses the `@dataclass(frozen=True)` decorator. It makes the class immutable, similar to a tuple, and automatically generates a `__hash__` method, allowing instances to be used as dictionary keys or stored in sets. Mental model: A frozen dataclass is a read-only container; once you lock it, any attempt to change its fields raises a FrozenInstanceError.",
    "why": "Immutability prevents accidental state changes in data passed around your application. It also makes objects hashable, meaning they can be used in mappings or sets.",
    "where_used": [
      "FastAPI settings",
      "Domain-Driven Design (Value Objects)",
      "Caching keys"
    ]
  },
  "why_learning_this": [
    "You can safely pass data objects around without worrying about other functions mutating them.",
    "You can use complex data structures as keys in dictionaries or elements in sets."
  ],
  "common_mistakes": [
    {
      "title": "Mutating internal lists",
      "explanation": "Frozen only applies to the attributes directly on the class. If a field is a mutable object like a list, you can still mutate the list itself."
    },
    {
      "title": "Manual __hash__ conflicts",
      "explanation": "Providing a custom `__hash__` or `__eq__` method can conflict with the one generated by `frozen=True`, leading to unexpected equality behaviors."
    }
  ],
  "recall_questions": [
    {
      "q": "How do you make a dataclass immutable?",
      "answer": "By passing the `frozen=True` argument to the `@dataclass` decorator. This makes the generated class immutable.",
      "tier": "tier1"
    },
    {
      "q": "What additional magic method does `frozen=True` automatically generate?",
      "answer": "It automatically generates a `__hash__` method, making the instance hashable if its fields are also hashable.",
      "tier": "tier2"
    },
    {
      "q": "Why would you want to make a dataclass frozen?",
      "answer": "To prevent accidental state mutation, keeping data safe from unintended changes. It also allows the instances to be used as dictionary keys or in sets.",
      "tier": "tier2"
    }
  ],
  "understanding_checks": [
    {
      "type": "predict-output",
      "code": "from dataclasses import dataclass\n\n@dataclass(frozen=True)\nclass Config:\n    host: str\n    retries: int\n\nc = Config('localhost', 3)\ntry:\n    c.retries = 5\n    print('Changed')\nexcept Exception as e:\n    print(type(e).__name__)",
      "question": "What is printed when this code is executed?",
      "answer": "FrozenInstanceError",
      "why": "Because `frozen=True` prevents reassignment of fields after the object is created. Attempting to assign `c.retries = 5` raises a `dataclasses.FrozenInstanceError`."
    },
    {
      "type": "predict-output",
      "code": "from dataclasses import dataclass\nfrom typing import List\n\n@dataclass(frozen=True)\nclass Team:\n    name: str\n    members: List[str]\n\nt = Team('A', ['Alice'])\nt.members.append('Bob')\nprint(len(t.members))",
      "question": "What is printed when this code is executed?",
      "answer": "2",
      "why": "Frozen dataclasses only prevent reassignment of the attribute (`t.members = [...]`). They do not make the underlying mutable objects (like lists) immutable. The list itself can still be modified."
    }
  ],
  "code_walkthrough": {
    "code": "from dataclasses import dataclass\n\n@dataclass(frozen=True)\nclass Point:\n    x: int\n    y: int\n\np1 = Point(1, 2)\np2 = Point(1, 2)\npoints_set = {p1, p2}\nprint(len(points_set))",
    "focus": "points_set = {p1, p2} shows that frozen dataclasses are hashable and equal instances are deduplicated."
  },
  "aha_moment": {
    "code": "from dataclasses import dataclass\n\n@dataclass(frozen=True)\nclass CacheKey:\n    query: str\n\nmy_cache = {CacheKey('users'): 42}\nprint(my_cache[CacheKey('users')])",
    "prediction": "Will this successfully retrieve the value 42, or raise a KeyError because they are different objects?",
    "common_guess": "KeyError, because they are two different instances in memory.",
    "why": "It prints 42. `frozen=True` generates a `__hash__` method based on the fields. Since both instances have identical fields, they hash to the same value and `__eq__` evaluates to True, allowing them to act as identical dictionary keys."
  },
  "practice_tasks": [
    {
      "title": "Secure the Configuration",
      "prompt": "Given this standard dataclass `AppConfig`, modify it so that instances cannot be modified after initialization and can be used as dictionary keys.",
      "starter_code": "from dataclasses import dataclass\n\n@dataclass\nclass AppConfig:\n    api_key: str\n    max_connections: int = 10",
      "solution": "from dataclasses import dataclass\n\n@dataclass(frozen=True)\nclass AppConfig:\n    api_key: str\n    max_connections: int = 10"
    }
  ],
  "challenge": {
    "title": "Using Dataclasses in Sets",
    "prompt": "Create a frozen dataclass `UserIdentifier` with two string fields: `email` and `tenant_id`. Then, initialize a `set` containing two identical instances of `UserIdentifier` and print the length of the set.",
    "solution": "from dataclasses import dataclass\n\n@dataclass(frozen=True)\nclass UserIdentifier:\n    email: str\n    tenant_id: str\n\nu1 = UserIdentifier('a@b.com', '123')\nu2 = UserIdentifier('a@b.com', '123')\nusers = {u1, u2}\nprint(len(users))"
  },
  "sources": [
    "https://docs.python.org/3/library/dataclasses.html#frozen-instances"
  ]
}