{
  "slug": "mutable-vs-immutable",
  "title": "Mutable vs immutable objects",
  "roadmap": "python-swe",
  "kind": "concept",
  "tier": "tier2",
  "metadata": {
    "difficulty": "medium",
    "estimated_minutes": 40,
    "importance": 10,
    "interview_frequency": "high",
    "prerequisites": [
      "primitive-types"
    ],
    "unlocks": [
      "shallow-vs-deep-copy",
      "mutable-default-argument"
    ],
    "project_usage": [
      "Pydantic models",
      "config dictionaries",
      "FastAPI request bodies"
    ]
  },
  "glossary": [
    {
      "term": "in place",
      "definition": "Modifying the original object directly, rather than creating a brand-new copy of it.\nExample: `nums.append(4)`."
    },
    {
      "term": "shared-state",
      "definition": "When two or more parts of a program access and modify the exact same data in memory, often leading to unexpected bugs.\nExample: modifying a shared `list` via `b.append(1)`."
    }
  ],
  "overview": {
    "what": "An object is mutable if its contents can change after it is created, and immutable if they cannot.\nThink of a mutable object as a whiteboard you keep editing, and an immutable object as a printed page \u2014 to \"change\" it you must print a new page.\n\nHere are the built-in mutable types:\n\n- `list`: Calling `list.append(x)` appends an element to the list in place and returns `None`.\n- `dict`: Calling `dict.update(other)` modifies the dictionary in place and returns `None`. It raises a `TypeError` if the argument is not an iterable of key-value pairs.\n- `set`: Calling `set.add(x)` modifies the set in place and returns `None`. It raises a `TypeError` if the added element is unhashable.\n\nHere are the built-in immutable types:\n\n- `int`, `float`, and `bool`: These primitive values are strictly immutable.\n- `str`: Calling string methods like `s.upper()` returns a new `str` object, leaving the original untouched.\n- `tuple`: A tuple's structure cannot be changed after creation.\n\nBecause mutable objects are edited in place, they cannot be hashed.\nThis means a `list` cannot be used as a `dict` key, but an immutable type like a `str` or `tuple` can.\n\n\n  t = (1, [2, 3])\n  t[1].append(4)\n  print(t)  # (1, [2, 3, 4])\n\nThis is a sharp edge called shallow immutability.\nWhile the `tuple` itself cannot be resized or have its elements reassigned, a mutable object inside the `tuple` can still be modified in place.\nThis trap is covered fully in shallow-vs-deep-copy.\n\n\n  def add_item(item, cart=[]):\n      cart.append(item)\n      return cart\n\n  print(add_item(\"apple\"))   # ['apple']\n  print(add_item(\"banana\"))  # ['apple', 'banana']\n\nThis is another sharp edge called the mutable default argument trap.\nThe default `list` is created only once when the function is defined, causing it to silently accumulate state across calls.\nThis trap is covered fully in mutable-default-argument.",
    "why": "Mutability decides whether an operation edits an object in place or returns a new one.\nGetting this wrong causes two classic bugs.\nFirst, assuming a `str` method changed the string (it didn't).\n\nSecond, two variable names sharing one mutable object.\nWhen this happens, an in-place edit through one variable is unexpectedly seen through the other.",
    "where_used": [
      "Pydantic models",
      "config dictionaries",
      "API request bodies"
    ]
  },
  "why_learning_this": [
    "Avoiding shared-state bugs when the same `list` or `dict` is referenced from two places in an API handler",
    "Knowing why a `tuple` or `str` can be a `dict` key but a `list` cannot"
  ],
  "common_mistakes": [
    {
      "title": "Expecting a string to change in place",
      "explanation": "Calling `s.upper()` returns a new `str` object and leaves `s` unchanged.\nCalling it without reassigning the result does nothing.\nFix: reassign the variable, for example `s = s.upper()`."
    },
    {
      "title": "Sharing one mutable object by accident",
      "explanation": "After `b = a` where `a` is a `list` or `dict`, `a` and `b` reference the exact same object.\nThis means `a.append(x)` is visible through `b`.\nFix: copy the object using `a.copy()` when you need an independent version."
    }
  ],
  "recall_questions": [
    {
      "q": "What distinguishes a mutable object from an immutable one?",
      "answer": "A mutable object's contents can change after creation, such as `list`, `dict`, and `set`.\nAn immutable object's contents cannot change, such as `int`, `float`, `bool`, `str`, and `tuple`.",
      "tier": "tier1"
    },
    {
      "q": "When you 'change' a string, what actually happens?",
      "answer": "A brand new `str` object is created.\nThe original string is left untouched.",
      "tier": "tier1"
    },
    {
      "q": "Why can a string or tuple be used as a dict key but a list cannot?",
      "answer": "Strings and tuples are immutable, so their contents cannot change and they can safely be hashed as keys.\nA `list` is mutable, so it is unhashable and cannot be a `dict` key.\nNote that a `tuple` must only contain immutable elements to be used as a key.",
      "tier": "tier2"
    },
    {
      "q": "What happens if you modify a mutable object inside an immutable tuple?",
      "answer": "The inner mutable object changes in place.\nThe `tuple` structure remains the same, but its contents appear different, demonstrating shallow immutability.",
      "tier": "tier2"
    },
    {
      "q": "What happens if you use a mutable object like a list as a default argument in a function?",
      "answer": "The default `list` is created only once when the function is defined.\nBecause it is mutable, it silently accumulates state across multiple function calls, which is a common source of bugs.",
      "tier": "tier2"
    }
  ],
  "practice_tasks": [
    {
      "title": "Reassign string to see uppercase",
      "prompt": "The function below attempts to return an uppercase version of the input string, but it returns the original lowercase text instead.\nModify the code to correctly return the uppercase version.\nRemember that `str` methods return new strings rather than modifying them in place.",
      "starter_code": "def make_upper(text):\n    text.upper()\n    return text\n\nprint(make_upper('hello'))",
      "solution": "def make_upper(text):\n    text = text.upper()\n    return text\n\nprint(make_upper('hello'))"
    }
  ],
  "code_walkthrough": {
    "code": "nums = [1, 2]\nnums.append(3)\nprint(nums)\n\ntext = 'hi'\ntext.upper()\nprint(text)",
    "focus": "The `list` prints `[1, 2, 3]` (changed in place); the `str` still prints `'hi'` because `.upper()` built a new string we ignored."
  },
  "aha_moment": {
    "code": "cart = ['laptop']\nbackup = cart\nbackup.append('mouse')\nprint(cart)",
    "prediction": "`backup` looks like a safe copy of `cart`. After appending `'mouse'` to `backup`, what does `print(cart)` show?",
    "common_guess": "['laptop']",
    "why": "`backup = cart` binds a second label to the same `list` object \u2014 it does not copy the list.\nSo `backup.append('mouse')` mutates the one `list` both names point to, and `cart` sees it too.\nFor an independent copy, use `cart.copy()`."
  },
  "challenge": {
    "title": "Merge config without mutating",
    "prompt": "Write `merge_config(base, override)` that returns a NEW `dict` combining both (`override` wins) WITHOUT mutating `base`.\nThen print the result and `base` to prove `base` is unchanged.",
    "solution": "def merge_config(base, override):\n    return {**base, **override}\n\nbase = {'debug': False, 'region': 'us'}\nresult = merge_config(base, {'debug': True})\nprint(result)\nprint(base)"
  },
  "sources": [
    "https://docs.python.org/3/reference/datamodel.html#objects-values-and-types",
    "https://docs.python.org/3/library/stdtypes.html#mutable-sequence-types"
  ],
  "understanding_checks": [
    {
      "type": "explain-behavior",
      "code": "x = [1, 2, 3]\ny = x\nx += [4]\nprint(y)",
      "question": "Why does `print(y)` output `[1, 2, 3, 4]` instead of `[1, 2, 3]`?",
      "answer": "Because `y = x` binds the variable `y` to the same underlying `list` object as `x`.\nThe `+=` operator on a `list` mutates the object in place, so `y` reflects the change.",
      "why": "Lists are mutable objects.\nWhen multiple variables reference the same mutable object, any in-place mutation to that object through one variable will be visible through all other variables referencing it."
    },
    {
      "type": "predict-output",
      "code": "a = 'hello'\nb = a\na += ' world'\nprint(b)",
      "question": "What is the output of this code?",
      "answer": "`hello`",
      "why": "Strings are immutable, so `a += ' world'` does not modify the original string `'hello'`.\nInstead, it creates a new `str` object `'hello world'` and reassigns the variable `a` to point to it.\nThe variable `b` still references the original `'hello'` string."
    }
  ]
}