{
  "slug": "exception-chaining",
  "title": "Exception chaining with raise from",
  "roadmap": "python-swe",
  "kind": "concept",
  "tier": "tier3",
  "metadata": {
    "difficulty": "medium",
    "estimated_minutes": 30,
    "importance": 6,
    "interview_frequency": "low",
    "prerequisites": [
      "try-except",
      "raising-exceptions",
      "custom-exceptions"
    ],
    "unlocks": [],
    "project_usage": [
      "wrapping database driver errors in service layers",
      "converting third-party SDK errors",
      "clean API error responses"
    ]
  },
  "glossary": [
    {
      "term": "traceback",
      "definition": "A detailed report showing the sequence of function calls that led to an error in your code. Example: `Traceback (most recent call last):`"
    },
    {
      "term": "suppress",
      "definition": "To intentionally prevent an error message or signal from being shown or passed further up the chain. Example: `raise MyError from None`"
    }
  ],
  "overview": {
    "what": "Exception chaining links a new exception to the original exception that caused it, using the syntax `raise NewError() from original_error`. This explicitly sets the `__cause__` attribute on the new exception.\n\n  try:\n      int('not a number')\n  except ValueError as e:\n      raise RuntimeError('config parse failed') from e\n\nWhen this traceback prints, Python shows both errors: 'The above exception was the direct cause of the following exception' — the original `ValueError` stays visible for debugging, even though the caller only sees `RuntimeError`.\n\nIf you want to intentionally hide the original error instead (e.g. hiding database internals from a user), use `raise NewError() from None` to suppress the chain entirely — no `__cause__` is set and no 'direct cause' line is printed.",
    "why": "When building professional applications, you don't want low-level errors (like `psycopg2.IntegrityError`) leaking into your high-level business logic. You catch the database error and raise a clean domain error like `DuplicateUserError`. However, if you don't chain them, you lose the original database traceback, making debugging a nightmare. `raise from` solves this by giving callers a clean domain error to catch, while preserving the full diagnostic history for the logs.",
    "where_used": [
      "Service layers hiding repository/database implementation details",
      "API clients translating HTTP errors into SDK-specific exceptions",
      "Suppressing sensitive tracebacks using `from None`"
    ]
  },
  "why_learning_this": [
    "Preserving the root cause of an error while translating it to a domain-specific exception",
    "Suppressing noisy or sensitive tracebacks with `raise ... from None`",
    "Understanding implicit chaining (when Python automatically sets `__context__` because an error happened inside an `except` block)"
  ],
  "common_mistakes": [
    {
      "title": "Losing the traceback",
      "explanation": "If you catch an error and just `raise MyCustomError()` without the `from` clause, Python implicitly links them, but it signals that the new error happened *during the handling* of the first one, not that it is a direct translation. Using `from e` is the semantic way to translate errors."
    },
    {
      "title": "Chaining the wrong object",
      "explanation": "You must chain from the exception instance, not the class. `raise MyError from ValueError` is invalid. You must catch the instance: `except ValueError as e: raise MyError from e`."
    }
  ],
  "practice_tasks": [
    {
      "title": "Translate a Database Error",
      "prompt": "Modify `create_user` to catch the `KeyError` thrown by `db_insert`. When caught, raise a `ValueError('User exists')` explicitly chained from the caught `KeyError`.",
      "starter_code": "def db_insert(username):\n    raise KeyError('Duplicate key')\n\ndef create_user(username):\n    # TODO: Catch KeyError and raise ValueError('User exists') from it\n    db_insert(username)",
      "solution": "def db_insert(username):\n    raise KeyError('Duplicate key')\n\ndef create_user(username):\n    try:\n        db_insert(username)\n    except KeyError as e:\n        raise ValueError('User exists') from e"
    }
  ],
  "code_walkthrough": {
    "code": "def parse_config(data):\n    try:\n        return int(data['port'])\n    except (KeyError, ValueError) as e:\n        raise RuntimeError(\"Invalid config file\") from e\n\ntry:\n    parse_config({})\nexcept RuntimeError as e:\n    print(f\"High-level error: {e}\")\n    print(f\"Low-level root cause: {type(e.__cause__).__name__}\")",
    "focus": "The caller catches `RuntimeError` cleanly, but the `__cause__` attribute retains the original `KeyError` for logging."
  },
  "challenge": {
    "title": "Hide internal errors",
    "prompt": "Write `fetch_data()` that catches a `ConnectionError` and raises a `ServiceUnavailableError` from None to suppress the internal network stack trace.",
    "solution": "class ServiceUnavailableError(Exception): pass\n\ndef fetch_data():\n    try:\n        raise ConnectionError('Socket timeout')\n    except ConnectionError:\n        raise ServiceUnavailableError('Service down') from None"
  },
  "sources": [
    "https://docs.python.org/3/tutorial/errors.html#exception-chaining",
    "https://docs.python.org/3/reference/simple_stmts.html#the-raise-statement"
  ],
  "recall_questions": [
    {
      "q": "What syntax is used to explicitly chain a new exception to an original exception?",
      "answer": "`raise NewError() from original_error`. This explicitly sets the `__cause__` attribute and links the tracebacks."
    },
    {
      "q": "How do you suppress the original exception's traceback completely when raising a new exception?",
      "answer": "`raise NewError() from None`. This prevents the original exception from being printed in the traceback."
    }
  ],
  "understanding_checks": [
    {
      "type": "predict-output",
      "question": "What special attribute is populated when using `raise NewError() from original_error`?",
      "code": "try:\n    raise ValueError('bad value')\nexcept ValueError as e:\n    try:\n        raise RuntimeError('wrap') from e\n    except RuntimeError as new_e:\n        print(type(new_e.__cause__).__name__)",
      "answer": "ValueError",
      "why": "The `from e` syntax explicitly links the original exception as the direct cause, storing it in the `__cause__` attribute of the new exception."
    },
    {
      "type": "explain-behavior",
      "question": "How do you completely hide the original exception's traceback when raising a new exception, preventing it from being printed?",
      "answer": "By using the syntax `raise NewError() from None`.",
      "why": "Using `from None` explicitly suppresses exception chaining, hiding the original error completely from the logs."
    }
  ]
}